ImageName/Headliner/Show/Opener/Loc/Right/DateTime/Left/SecLabel/RowLabel/SeatLabel/Section/Row/Seat		
KISSOFLIFE_WORLDTOURKISSROAD.jpeg/KISS OF LIFE/WORLD TOUR: KISS ROAD//The Fillmore Silver Spring | Silver Spring	MD//November 19 | 8:00 PM//////GENERAL ADMISSION/	
KaceyMusgraves_DeeperWellWorldTour.jpeg/Kacey Musgraves/Deeper Well World Tour/NICKEL CREEK	 Lord Huron/CFG Bank Arena | Baltamore	MD//November 09 | 7:30 PM//SECTION/ROW/SEAT/209/D/21
SabrinaCarpenter_ShortnSweetTour.jpeg/Sabrina Carpenter/Short n' Sweet Tour/Griff/John Paul Jones Arena | Charlottesville	VA//October 20 | 7:00 PM//SECTION/ROW/SEAT/305/P/21	
SarahKinsley_TheEscaperTour.jpeg/Sarah Kinsley /The Escaper Tour /Ha Vay/Union Stage  | Washington	DC//October 06 | 7:00 PM///////	
(G)I-DLEWORLDTOUR_[iDOL]INTHEU.S..jpeg/(G)I-DLE WORLD TOUR/[iDOL] IN THE U.S.//UBS Arena | Belmont Park	NY//September 18 | 7:30 PM//SECTION/ROW/SEAT/110/9/1	
ATEEZWORLDTOUR[TOWARDSTHELIGHTWILLTOPOWER].jpeg/ATEEZ WORLD TOUR /[TOWARDS THE LIGHT : WILL TO POWER] IN NORTH AMERICA//Capital One Arena  | Washington	DC//August 06 | 7:30 PM//SECTION/ROW/SEAT/408/H/16	
TheVolunteers.jpeg/The Volunteers///Harrisburg Midtown Arts Center (HMAC) Capitol Room | Harrisburg	PA//July 17 | 6:00 PM//////GENERAL ADMISSION/	
Laufey_WilliamsburgArtsFestival.jpeg/Laufey/Williamsburg Arts Festival /Grace Engar/Art Museums of Colonial Williamsburg | Williamsburg	VA//June 23 | 7:00 PM//////GENERAL ADMISSION: LAWN/	
ITZY_2NDWORLDTOURBORNTOBE.jpeg/ITZY/2ND WORLD TOUR 'BORN TO BE'//Eagle Bank Arena | Fairfax	VA//June 20 | 8:00 PM//SECTION/ROW/SEAT/109/J/7	
TOMORROWXTOGETHER_WorldTourActPromiseInU.S..jpeg/TOMORROW X TOGETHER/World Tour 'Act : Promise' In U.S.//Capital One Arena  | Washington	DC//June 08 | 7:30 PM//SECTION/ROW/SEAT/409/K/1	
LukeHemmings_NostalgiaforaTimeThatNeverExisted.jpeg/Luke Hemmings/Nostalgia for a Time That Never Existed/Cafuné/9:30 Club | Washington	DC//May 26 | 8:00 PM//////GENERAL ADMISSION/	
BM_AfterTheAfterParty.jpeg/BM/After The After Party/sunkis | CLUB BOYBND/Karma DC Live Music Venue | Washington	DC//May 25 | 4:00 PM//////GENERAL ADMISSION/	
TheDriverEra_EastCoastTour.jpeg/The Driver Era/East Coast Tour/VALÉ/The Fillmore Silver Spring | Silver Spring	MD//April 23 | 8:00 PM//////GENERAL ADMISSION/	
IVE_The1stWorldTourShowWhatIHave.jpeg/IVE/The 1st World Tour 'Show What I Have'//Prudential Center | Newark	NJ//March 29 | 8:00 PM//SECTION/ROW/SEAT/2/17/17	
Girli_MatriarchyTour.jpeg/Girli/Matriarchy Tour/Massie/The Atlantis | Washington	DC//March 01 | 6:30 PM//////GENERAL ADMISSION/	
TheRose_DawnToDuskTour.jpeg/The Rose /Dawn To Dusk Tour//Eagle Bank Arena | Fairfax	VA//October 24 | 8:00 PM//SECTION/ROW/SEAT/109/U/5	
BETWEENFRIENDS_ILoveMyGirlShesMyBoyTour.jpeg/BETWEEN FRIENDS/I Love My Girl She's My Boy Tour/Blaketheman1000/Union Stage | Washington	DC//October 16 | 8:00 PM//////GENERAL ADMISSION/	
MaudeLatour_TwinFlameTour.jpeg/Maude Latour /Twin Flame Tour /Devon Again/9:30 Club | Washington	DC//October 15 | 8:00 PM//////GENERAL ADMISSION/	
The5SecondsofSummerShow.jpeg/The 5 Seconds of Summer Show//Meet Me @ the Altar/Jiffy Lube Live | Bristow	VA//August 18 | 8:00 PM//SECTION/ROW/SEAT/304/M/13	
BLACKPINK_BornPinkWorldTourEncore.jpeg/BLACKPINK/Born Pink World Tour Encore//MetLife Stadium | East Rutherford	NJ//August 12 | 8:30 PM//SECTION/ROW/SEAT/323/21/6	
TaylorSwift_TheErasTour.jpeg/Taylor Swift/The Eras Tour/Gracie Abrams | Girl in Red /Acrisure Stadium  | Pittsburgh	PA//June 16 | 8:00 PM//SECTION/ROW/SEAT/526/S/3	
TOMORROWXTOGETHER_ActSweetMirageWorldTour.jpeg/TOMORROW X TOGETHER/Act: Sweet Mirage World Tour//Capital One Arena  | Washington	DC//May 16 | 7:00 PM//SECTION/ROW/SEAT/401/K/6	
TheWrecks_Back&BetterThanEverTour.jpeg/The Wrecks/Back & Better Than Ever Tour/Arlie/Elevation 27 | Virginia Beach	VA //October 30 | 8:00 PM//////GENERAL ADMISSION/	
BadSuns_ApocalypseWheneverTour.jpeg/Bad Suns/Apocalypse Whenever Tour/Quarters of Change | Last Dinosaurs /The National | Richmond	VA//October 25 | 8:00 PM//////GENERAL ADMISSION/	
AllThingsGoMusicFestival_2022.jpeg/All Things Go Music Festival//Lorde | Maude Latour | Hippo Campus | Mitski | Bleachers/Merriweather Post Pavilion | Columbia	MD//October 01 | 12:00 PM//////GENERAL ADMISSION: LAWN/	
Coin_UncannyValleyTour.jpeg/Coin/Uncanny Valley Tour/Miloe /The NorVa | Norfolk	VA//September 27 | 8:00 PM//////GENERAL ADMISSION/	
Lauv_All4NothingTour.jpeg/Lauv/All 4 Nothing Tour/Hayley Kiyoko/The Anthem | Washington	DC//August 25 | 7:30 PM//////GENERAL ADMISSION/	
5SecondsofSummer_TakeMyHandWorldTour.jpeg/5 Seconds of Summer/Take My Hand World Tour/Pale Waves/The Anthem | Washington	DC//July 05 | 7:00 PM//////GENERAL ADMISSION/	
DuaLipa_FutureNostalgiaTour.jpeg/Dua Lipa/Future Nostalgia Tour//Gröna Lund | Stockholm//June 28 | 8:00 PM//////GENERAL ADMISSION/		
TheDriverEra_TheGirlfriendTour.jpeg/The Driver Era /The Girlfriend Tour/Moon Tower | The Wrecks/The NorVa | Norfolk	VA//November 28 | 7:00 PM//////GENERAL ADMISSION/	
ThomasRhett_VeryHotSummerTour.jpeg/Thomas Rhett/Very Hot Summer Tour/Dustin Lynch | Russell Dickerson/Jiffy Lube Live | Bristow	VA//June 15 | 8:00 PM//////GENERAL ADMISSION: LAWN/	
LANY_MalibuNightsWorldTour.jpeg/LANY/Malibu Nights World Tour/Fletcher/9:30 Club | Washington	DC//May 16 | 7:30 PM//////GENERAL ADMISSION/	
PictureThis_MDRNLVTour.jpeg/Picture This/MDRN LV Tour/Future Feats/Rock N Roll Hotel | Washington	DC//April 27 | 8:00 PM//////GENERAL ADMISSION/	
NiallHoran_FlickerWorldTour.jpeg/Niall Horan/Flicker World Tour/Maren Morris/Jiffy Lube Live | Bristow	VA//August 31 | 7:30 PM//////GENERAL ADMISSION: LAWN/	
Panic!attheDisco_PrayfortheWickedTour.jpeg/Panic! at the Disco/Pray for the Wicked Tour/Hayley Kiyoko | ARIZONA/PPG Paints Arena | Pittsburgh	PA//July 18 | 7:30 PM//SECTION/ROW/SEAT/218/J/9	
Halsey_HopelessFountainKingdomTour.jpeg/Halsey/Hopeless Fountain Kingdom Tour: The Final Installment/Jessie Reyez/Wolf Trap | Vienna	VA//July 15 | 8:00 PM//////GENERAL ADMISSION: LAWN/	
HarryStylesLiveonTour.jpeg/Harry Styles: Live on Tour//Kasey Musgraves/Capital One Arena | Washington	DC//June 24 | 8:00 PM//SECTION/ROW/SEAT/121/M/15	
Khalid_RoxyTour.jpeg/Khalid/Roxy Tour/Prettymuch/Pier Six Pavilion | Baltamore	MD//June 04 | 7:30 PM//SECTION/ROW/SEAT/104/D/4	
DuaLipa_TheSelf-TitledTour.jpeg/Dua Lipa/The Self-Titled Tour/Marteen/The Fillmore Silver Spring | Silver Spring	MD//November 28 | 7:30 PM//////GENERAL ADMISSION/	
Halsey_HopelessFountainKingdomTour.jpeg/Halsey/Hopeless Fountain Kingdom Tour: Installment I/PartyNextDoor | Charli XCX/Capital One Arena | Washington	DC//October 09 | 8:00 PM//SECTION/ROW/SEAT/4/G/10	
TroyeSivan_SuburbiaTour.jpeg/Troye Sivan/Suburbia Tour/Dua Lipa/Eagle Bank Arena | Fairfax	VA//November 17 | 7:00 PM//SECTION/ROW/SEAT/129/J/4	